{
    "job_name": "dev_coingecko_market_price",

    "system": "el",

    "job_type": "ingestion",

    "sub_jobtype": "api",

    "metadata": {

        "source": "coingecko",
        "dataset": "market_price",
        "entity": "cryptocurrency"
    },

    "exec": {

        "exec_type": "ApiExecCmd",
        "base_url": "https://api.coingecko.com/api/v3",
        "path": "/coins/markets",
        "pagination": {

            "strategy": "page",
            "page_param": "page"
        },

        "page_size": {

            "param": "per_page",
            "value": 50
        },

        "query_params": {

            "vs_currency": "inr"
        },

        "auth": {

            "auth_type": "api_key",
            "key_env": "COINGECKO_API_KEY",
            "location": "header",
            "name": "x-cg-demo-api-key"
        }
    },

    "dest": {

        "dest_type": "GCS",
        "bucket": "dev-market-analytics-platform-bucket",
        "layer": "dev",
        "format": "parquet",
        "path_template": "{layer}/{source}/{dataset}/{entity}/ingestion_dt={ingestion_dt}/ingestion_ts={ingestion_ts}.{format}"
    }
}